{
  "$schema": "../../../../schemas/asset-license-set.schema.json",
  "schemaVersion": "1.0.0",
  "licenseSetId": "licenses.guns-only.cobra-vietnam.textures.v1",
  "template": false,
  "entries": [
    {
      "licenseId": "license.guns-only-cobra-ground-macro.v1",
      "appliesTo": [
        "environment.texture.cobra-ground-macro-painted.v1"
      ],
      "spdxExpression": "MIT",
      "copyright": "Copyright (c) 2026 Ian Todd",
      "authors": ["Ian Todd"],
      "sourceUri": "repo://content/packs/cobra-vietnam/environment/textures/cobra-ground-art-manifest.v1.json",
      "redistribution": {
        "allowed": true,
        "commercialUseAllowed": true,
        "modificationAllowed": true,
        "shareAlikeRequired": false,
        "notices": [
          "Include the repository MIT copyright and permission notice in copies or substantial portions."
        ]
      },
      "attributionText": "Guns Only project-authored Cobra ground macro, Copyright (c) 2026 Ian Todd, licensed under MIT.",
      "evidence": [
        {"type": "license_file", "uri": "repo://LICENSE"},
        {"type": "author_statement", "uri": "repo://content/packs/cobra-vietnam/environment/textures/cobra-ground-art-manifest.v1.json"}
      ],
      "notes": "OpenAI built-in image generation under human art direction; resized to 1024 square for shared WebGL and Unity presentation."
    }
  ]
}
