{
  "$schema": "../../schemas/asset-license-set.schema.json",
  "schemaVersion": "1.0.0",
  "licenseSetId": "licenses.guns-only.project.v1",
  "template": false,
  "entries": [
    {
      "licenseId": "license.project-code.v1",
      "appliesTo": [
        "cockpit.player.sabre-fury.v1",
        "environment.ocean.deep.v1",
        "environment.sky.haze.v1",
        "environment.texture.korea-highland-ground.v1",
        "platform.carrier.straight-deck.v1",
        "platform.escort.gun-destroyer.v1",
        "procedural://carrier/current",
        "procedural://effects/destruction/current",
        "procedural://effects/gun/current",
        "procedural://environment/ocean/current",
        "procedural://environment/sky/current",
        "procedural://fighter/current",
        "vehicle.bandit.swept-wing.v1",
        "vehicle.player.sabre-fury.v1",
        "vfx.gun.fire.v1",
        "vfx.gun.impact.v1",
        "vfx.platform.wake.v1",
        "vfx.vehicle.destroyed.v1"
      ],
      "spdxExpression": "MIT",
      "copyright": "Copyright (c) 2026 Ian Todd",
      "authors": [
        "Ian Todd"
      ],
      "sourceUri": "repo://tools/assets/generators/",
      "redistribution": {
        "allowed": true,
        "commercialUseAllowed": true,
        "modificationAllowed": true,
        "shareAlikeRequired": false,
        "notices": [
          "Include the repository MIT copyright and permission notice in copies or substantial portions."
        ]
      },
      "attributionText": "Guns Only project-authored renderer assets, Copyright (c) 2026 Ian Todd, licensed under MIT.",
      "evidence": [
        {
          "type": "license_file",
          "uri": "repo://LICENSE"
        }
      ],
      "notes": "Covers project-authored generated geometry, material profiles, textures, shaders, and procedural factories. Imported models, textures, fonts, and audio require their own entries before merge."
    },
    {
      "licenseId": "license.copernicus-dem-glo30.v1",
      "appliesTo": [
        "environment.terrain.central-front.v2"
      ],
      "spdxExpression": "LicenseRef-Copernicus-DEM-GLO-30-F",
      "copyright": "© DLR e.V. 2010-2014 and © Airbus Defence and Space GmbH 2014-2018",
      "authors": [
        "DLR e.V.",
        "Airbus Defence and Space GmbH",
        "European Union Copernicus Programme",
        "European Space Agency"
      ],
      "sourceUri": "https://copernicus-dem-30m.s3.amazonaws.com/",
      "redistribution": {
        "allowed": true,
        "commercialUseAllowed": true,
        "modificationAllowed": true,
        "shareAlikeRequired": false,
        "notices": [
          "produced using Copernicus WorldDEM-30 © DLR e.V. 2010-2014 and © Airbus Defence and Space GmbH 2014-2018 provided under COPERNICUS by the European Union and ESA; all rights reserved",
          "The organisations in charge of the Copernicus programme by law or by delegation do not incur any liability for any use of the Copernicus WorldDEM-30.",
          "No endorsement by the Provider, Licensor, European Union, ESA, or other Copernicus entities is implied."
        ]
      },
      "attributionText": "produced using Copernicus WorldDEM-30 © DLR e.V. 2010-2014 and © Airbus Defence and Space GmbH 2014-2018 provided under COPERNICUS by the European Union and ESA; all rights reserved",
      "evidence": [
        {
          "type": "license_file",
          "uri": "https://copernicus-dem-30m.s3.amazonaws.com/Copernicus_DSM_COG_10_N37_00_E126_00_DEM/INFO/eula_F.pdf"
        },
        {
          "type": "source_page",
          "uri": "repo://content/sources/korea-terrain-source-lock.json"
        }
      ],
      "notes": "Derived runtime heights, water classification, LOD bundles, simulation truth, and QA preview. Raw source GeoTIFFs remain outside Git."
    }
  ]
}
